{
	"info": {
		"_postman_id": "e7184e35-6b23-4990-af06-cf5186ad44c5",
		"name": "Servidor",
		"description": "## ‚öôÔ∏è Configura√ß√£o\n\n### **Vari√°veis de Ambiente**\n\n| Vari√°vel | Valor Exemplo | Descri√ß√£o |\n| --- | --- | --- |\n| base_url | [http://localhost:8000](http://localhost:8000) | URL base da API |\n| query | sa√∫de | Query padr√£o para testes |\n| page | 1 | N√∫mero da p√°gina |\n| size | 10 | N√∫mero de elementos por p√°gina |\n\n## üóÇÔ∏è Documenta√ß√£o  \n\nReposit√≥rio dos testes de nivelamento: [https://github.com/gabrieudev/teste](https://github.com/gabrieudev/teste)",
		"schema": "https://schema.getpostman.com/json/collection/v2.1.0/collection.json",
		"_exporter_id": "43537733",
		"_collection_link": "https://www.postman.com/descent-module-astronomer-92107099/workspace/collection-teste/collection/43537733-e7184e35-6b23-4990-af06-cf5186ad44c5?action=share&source=collection_link&creator=43537733"
	},
	"item": [
		{
			"name": "Requisi√ß√µes",
			"item": [
				{
					"name": "Buscar operadoras",
					"event": [
						{
							"listen": "test",
							"script": {
								"exec": [
									"pm.test(\"Resposta v√°lida e coerente com os par√¢metros\", () => {\r",
									"    const response = pm.response.json();\r",
									"\r",
									"    const expectedQuery = pm.variables.get(\"query\");\r",
									"    const expectedPage = parseInt(pm.variables.get(\"page\"), 10);\r",
									"    const expectedSize = parseInt(pm.variables.get(\"size\"), 10);\r",
									"\r",
									"    pm.expect(response).to.be.an(\"object\");\r",
									"    pm.expect(response).to.have.property(\"results\").that.is.an(\"array\");\r",
									"    pm.expect(response).to.have.property(\"page\").that.is.a(\"number\");\r",
									"    pm.expect(response).to.have.property(\"size\").that.is.a(\"number\");\r",
									"    pm.expect(response).to.have.property(\"total\").that.is.a(\"number\");\r",
									"\r",
									"    pm.expect(response.page).to.equal(expectedPage);\r",
									"    pm.expect(response.size).to.equal(expectedSize);\r",
									"\r",
									"    pm.expect(response.results.length).to.be.at.most(expectedSize);\r",
									"\r",
									"    if (expectedQuery) {\r",
									"        response.results.forEach(item => {\r",
									"            const searchFields = [\r",
									"                item.nome_fantasia,\r",
									"                item.razao_social,\r",
									"                item.modalidade\r",
									"            ].join(\" \").toLowerCase();\r",
									"\r",
									"            pm.expect(searchFields).to.include(expectedQuery.toLowerCase());\r",
									"        });\r",
									"    }\r",
									"\r",
									"    response.results.forEach(item => {\r",
									"        pm.expect(item).to.have.property(\"bairro\").that.is.a(\"string\");\r",
									"        pm.expect(item).to.have.property(\"cidade\").that.is.a(\"string\");\r",
									"        pm.expect(item).to.have.property(\"cnpj\").that.is.a(\"string\");\r",
									"        pm.expect(item).to.have.property(\"logradouro\").that.is.a(\"string\");\r",
									"        pm.expect(item).to.have.property(\"modalidade\").that.is.a(\"string\");\r",
									"        pm.expect(item).to.have.property(\"nome_fantasia\").that.is.a(\"string\");\r",
									"        pm.expect(item).to.have.property(\"registro_ans\").that.is.a(\"string\");\r",
									"        pm.expect(item).to.have.property(\"telefone\").that.is.a(\"string\");\r",
									"        pm.expect(item).to.have.property(\"uf\").that.is.a(\"string\");\r",
									"    });\r",
									"});\r",
									""
								],
								"type": "text/javascript",
								"packages": {}
							}
						}
					],
					"request": {
						"method": "GET",
						"header": [],
						"url": {
							"raw": "{{base_url}}/search?query={{query}}&page={{page}}&size={{size}}",
							"host": [
								"{{base_url}}"
							],
							"path": [
								"search"
							],
							"query": [
								{
									"key": "query",
									"value": "{{query}}"
								},
								{
									"key": "page",
									"value": "{{page}}"
								},
								{
									"key": "size",
									"value": "{{size}}"
								}
							]
						}
					},
					"response": []
				}
			],
			"description": "### **üîó GET /search**\n\n- **Descri√ß√£o**: Realiza busca textual nas operadoras com pagina√ß√£o.\n    \n- **M√©todo**: GET\n    \n- **URL**: `{{base_url}}/search`\n    \n- **Par√¢metros**:\n    \n    - Query Params:\n        \n        - query: string (obrigat√≥rio)\n            \n        - page: integer (obrigat√≥rio, padr√£o: 1)\n            \n        - size: integer (obrigat√≥rio, padr√£o: 5)\n            \n\n#### **Exemplos de Requests**\n\n| Descri√ß√£o | URL de Exemplo |\n| --- | --- |\n| Busca com pagina√ß√£o | {{base_url}}/search?query=sa√∫de&page=2&size=5 |\n\n#### **Response (200 OK)**\n\n``` json\n{\n    \"page\": 1,\n    \"results\": [\n        {\n            \"bairro\": \"SETOR BUENO\",\n            \"cargo_representante\": \"DIRETOR GERAL\",\n            \"cep\": \"74215025\",\n            \"cidade\": \"Goi√¢nia\",\n            \"cnpj\": \"00395266000180\",\n            \"complemento\": \"QD 87, LOTE 23, SALAS 1a4\",\n            \"data_registro_ans\": \"Mon, 06 Dec 2004 00:00:00 GMT\",\n            \"ddd\": \"62\",\n            \"endereco_eletronico\": \"elias@maissaudeplano.com.br\",\n            \"fax\": null,\n            \"logradouro\": \"AVENIDA T-9\",\n            \"modalidade\": \"Medicina de Grupo\",\n            \"nome_fantasia\": \"MAIS SA√öDE PLANO DE SA√öDE \",\n            \"numero\": \"735\",\n            \"razao_social\": \"MAIS SA√öDE PLANO DE SA√öDE LTDA\",\n            \"regiao_de_comercializacao\": 6,\n            \"registro_ans\": \"415065\",\n            \"representante\": \"ELIAS FRANCISCO DE OLIVEIRA\",\n            \"telefone\": \"31214600\",\n            \"uf\": \"GO\"\n        },\n        {\n            \"bairro\": \"ASA NORTE\",\n            \"cargo_representante\": \"PRESIDENTE\",\n            \"cep\": \"70730630\",\n            \"cidade\": \"Bras√≠lia\",\n            \"cnpj\": \"11828089000103\",\n            \"complemento\": \"BLOCO C, LOJA 48\",\n            \"data_registro_ans\": \"Thu, 12 Jan 2012 00:00:00 GMT\",\n            \"ddd\": \"61\",\n            \"endereco_eletronico\": \"negocios@evida.org.br\",\n            \"fax\": null,\n            \"logradouro\": \"SETOR DE HABITA√á√ïES COLETIVAS GEMINADAS \",\n            \"modalidade\": \"Autogest√£o\",\n            \"nome_fantasia\": \"LUMINAR SA√öDE\",\n            \"numero\": \"QUADRA 704/705\",\n            \"razao_social\": \"LUMINAR SA√öDE - ASSOCIA√á√ÉO DE ASSIST√äNCIA √Ä SA√öDE\",\n            \"regiao_de_comercializacao\": 4,\n            \"registro_ans\": \"418374\",\n            \"representante\": \"JORGE EDUARDO BRAGA NETO\",\n            \"telefone\": \"39668300\",\n            \"uf\": \"DF\"\n        },\n        {\n            \"bairro\": \"CAMBUCI\",\n            \"cargo_representante\": \"REPRESENTANTE JUNTO √Ä ANS\",\n            \"cep\": \"01540020\",\n            \"cidade\": \"S√£o Paulo\",\n            \"cnpj\": \"03849449000117\",\n            \"complemento\": null,\n            \"data_registro_ans\": \"Fri, 21 Jul 2000 00:00:00 GMT\",\n            \"ddd\": \"11\",\n            \"endereco_eletronico\": \"diretoria@maisazulsaude.com.br\",\n            \"fax\": \"33885010\",\n            \"logradouro\": \"RUA ALBUQUERQUE MARANH√ÉO\",\n            \"modalidade\": \"Medicina de Grupo\",\n            \"nome_fantasia\": \"CRUZ AZUL SA√öDE\",\n            \"numero\": \"72\",\n            \"razao_social\": \"ASSOCIA√á√ÉO ASSISTENCIAL DE SA√öDE SUPLEMENTAR CRUZ AZUL SA√öDE\",\n            \"regiao_de_comercializacao\": 4,\n            \"registro_ans\": \"411752\",\n            \"representante\": \"EDGAR CUCCOLO\",\n            \"telefone\": \"33885000\",\n            \"uf\": \"SP\"\n        },\n        {\n            \"bairro\": \"CENTRO\",\n            \"cargo_representante\": \"Diretor Presidente\",\n            \"cep\": \"20050900\",\n            \"cidade\": \"Rio de Janeiro\",\n            \"cnpj\": \"34844263000107\",\n            \"complemento\": \"SALA 501\",\n            \"data_registro_ans\": \"Wed, 11 Dec 2019 00:00:00 GMT\",\n            \"ddd\": \"21\",\n            \"endereco_eletronico\": \"governanca@eletrossaude.com.br\",\n            \"fax\": null,\n            \"logradouro\": \"RUA URUGUAIANA\",\n            \"modalidade\": \"Autogest√£o\",\n            \"nome_fantasia\": \"ELETROS-SA√öDE\",\n            \"numero\": \"174\",\n            \"razao_social\": \"ELETROS SA√öDE - ASSOCIA√á√ÉO DE ASSIST√äNCIA √Ä SA√öDE\",\n            \"regiao_de_comercializacao\": null,\n            \"registro_ans\": \"422070\",\n            \"representante\": \"ROG√âRIO CARLOS LAMIM BRAZ\",\n            \"telefone\": \"21386000\",\n            \"uf\": \"RJ\"\n        },\n        {\n            \"bairro\": \"SAMAMBAIA\",\n            \"cargo_representante\": \"ADMINISTRADOR\",\n            \"cep\": \"83535000\",\n            \"cidade\": \"Campo Magro\",\n            \"cnpj\": \"02862447000103\",\n            \"complemento\": \"TERREO\",\n            \"data_registro_ans\": \"Thu, 17 Dec 1998 00:00:00 GMT\",\n            \"ddd\": \"41\",\n            \"endereco_eletronico\": \"nossasaude@nossasaude.com.br\",\n            \"fax\": \"32404700\",\n            \"logradouro\": \"RUA URSULA ERCOLE CUMIN\",\n            \"modalidade\": \"Medicina de Grupo\",\n            \"nome_fantasia\": \"NOSSA SA√öDE\",\n            \"numero\": \"211\",\n            \"razao_social\": \"NOSSA SA√öDE - OPERADORA PLANOS PRIVADOS DE ASSIST√äNCIA  √Ä SA√öDE LTDA.\",\n            \"regiao_de_comercializacao\": 4,\n            \"registro_ans\": \"372609\",\n            \"representante\": \"DULCIMAR DE CONTO\",\n            \"telefone\": \"32404700\",\n            \"uf\": \"PR\"\n        }\n    ],\n    \"size\": 5,\n    \"total\": 278\n}\n\n ```\n\n---\n\n### **Script de teste**\n\nValida√ß√µes autom√°ticas com as seguintes funcionalidades:\n\n- Busca das vari√°veis do Postman (query, page, size).\n    \n- Verifica se os valores retornados na resposta correspondem aos par√¢metros enviados.\n    \n- Garante que o n√∫mero de resultados n√£o ultrapassa o tamanho da p√°gina (size).\n    \n- Valida se os resultados cont√™m o termo de pesquisa (query) nos campos relevantes.\n    \n- Verifica se cada item da lista possui os campos esperados.\n    \n\n``` javascript\npm.test(\"Resposta v√°lida e coerente com os par√¢metros\", () => {\n    const response = pm.response.json();\n    const expectedQuery = pm.variables.get(\"query\");\n    const expectedPage = parseInt(pm.variables.get(\"page\"), 10);\n    const expectedSize = parseInt(pm.variables.get(\"size\"), 10);\n    pm.expect(response).to.be.an(\"object\");\n    pm.expect(response).to.have.property(\"results\").that.is.an(\"array\");\n    pm.expect(response).to.have.property(\"page\").that.is.a(\"number\");\n    pm.expect(response).to.have.property(\"size\").that.is.a(\"number\");\n    pm.expect(response).to.have.property(\"total\").that.is.a(\"number\");\n    pm.expect(response.page).to.equal(expectedPage);\n    pm.expect(response.size).to.equal(expectedSize);\n    pm.expect(response.results.length).to.be.at.most(expectedSize);\n    if (expectedQuery) {\n        response.results.forEach(item => {\n            const searchFields = [\n                item.nome_fantasia,\n                item.razao_social,\n                item.modalidade\n            ].join(\" \").toLowerCase();\n            pm.expect(searchFields).to.include(expectedQuery.toLowerCase());\n        });\n    }\n    response.results.forEach(item => {\n        pm.expect(item).to.have.property(\"bairro\").that.is.a(\"string\");\n        pm.expect(item).to.have.property(\"cidade\").that.is.a(\"string\");\n        pm.expect(item).to.have.property(\"cnpj\").that.is.a(\"string\");\n        pm.expect(item).to.have.property(\"logradouro\").that.is.a(\"string\");\n        pm.expect(item).to.have.property(\"modalidade\").that.is.a(\"string\");\n        pm.expect(item).to.have.property(\"nome_fantasia\").that.is.a(\"string\");\n        pm.expect(item).to.have.property(\"registro_ans\").that.is.a(\"string\");\n        pm.expect(item).to.have.property(\"telefone\").that.is.a(\"string\");\n        pm.expect(item).to.have.property(\"uf\").that.is.a(\"string\");\n    });\n});\n\n ```"
		}
	],
	"event": [
		{
			"listen": "prerequest",
			"script": {
				"type": "text/javascript",
				"packages": {},
				"exec": [
					""
				]
			}
		},
		{
			"listen": "test",
			"script": {
				"type": "text/javascript",
				"packages": {},
				"exec": [
					""
				]
			}
		}
	],
	"variable": [
		{
			"key": "base_url",
			"value": "http://localhost:5000",
			"type": "string"
		},
		{
			"key": "query",
			"value": "SAUDE",
			"type": "string"
		},
		{
			"key": "page",
			"value": "1",
			"type": "string"
		},
		{
			"key": "size",
			"value": "10",
			"type": "string"
		}
	]
}